{
  "id": "assertion-cultivation-transplant",
  "subject": { "type": "plant-concept", "id": "plant-tomato" },
  "predicate": "cultivation_window",
  "value": {
    "action": "transplant",
    "timing": {
      "type": "calendar-date-window",
      "start": { "month": 5, "day": 1 },
      "end": { "month": 6, "day": 15 }
    },
    "sourceAction": "transplant",
    "sourceTiming": { "start": "05-01", "end": "06-15" },
    "mappingMethod": "normalized-source-timing"
  },
  "contextId": "context-outdoor",
  "evidenceReferenceIds": ["evidence-cultivation-transplant"],
  "reviewId": "review-cultivation"
}
